original_row_num,url,crawl_time,crawl_status,error_msg,api,package,language,deprecated_in,removed_in,replaced_by,change_type,reason,source
431,https://numpy.org/doc/stable/reference/generated/numpy.around.html,2025-09-25 09:34:08,success,,numpy.around,NumPy,Python,,,numpy.round,Behavior Change,NumPy `around` is an alias for `round` and maintains equivalent behavior. This clarification serves to streamline understanding between the two APIs and their functionalities.,https://numpy.org/doc/stable/reference/generated/numpy.around.html
441,https://numpy.org/doc/stable/reference/generated/numpy.cumulative_sum.html,2025-09-25 09:34:31,success,,numpy.cumulative_sum,NumPy,Python,,,numpy.cumsum,Behavior Change,"numpy.cumulative_sum was introduced as an Array API-compatible alternative to numpy.cumsum, offering functionality to include an initial value and better compliance with the Array API standard.",https://numpy.org/doc/stable/reference/generated/numpy.cumulative_sum.html
442,https://numpy.org/doc/stable/reference/generated/numpy.cumulative_prod.html,2025-09-25 09:34:31,success,,numpy.cumulative_prod,NumPy,Python,,,numpy.cumprod,Parameter Change,"Improved compatibility with the Array API standard and enhanced functionality by supporting the `include_initial` parameter, which was not present in numpy.cumprod.",https://numpy.org/doc/stable/reference/generated/numpy.cumulative_prod.html
443,https://numpy.org/doc/stable/reference/generated/numpy.cumprod.html,2025-09-25 09:34:41,success,,numpy.cumprod,NumPy,Python,,,numpy.cumulative_prod,API Deprecation,The `numpy.cumulative_prod` interface provides better compatibility with the Array API standard.,https://numpy.org/doc/stable/reference/generated/numpy.cumprod.html
444,https://numpy.org/doc/stable/reference/generated/numpy.cumsum.html,2025-09-25 09:34:41,success,,numpy.cumsum,numpy,Python,,,numpy.cumulative_sum (Array API compatible alternative),Behavior Change,Modular arithmetic behavior in integer types and floating-point roundoff differences in summation operations.,https://numpy.org/doc/stable/reference/generated/numpy.cumsum.html
450,https://numpy.org/doc/stable/reference/generated/numpy.cross.html,2025-09-25 09:34:57,success,,numpy.cross,NumPy,Python,2.0.0,,linalg.cross,API Deprecation,Dimension-2 input arrays were deprecated to improve API consistency and encourage the usage of higher-dimensional arrays for cross products.,https://numpy.org/doc/stable/reference/generated/numpy.cross.html
461,https://numpy.org/doc/stable/reference/generated/numpy.i0.html,2025-09-25 09:35:26,success,,i0,numpy,Python,,,scipy.special.i0,Performance Optimization,"The scipy implementation is a proper ufunc written in C, and offers significantly better performance than numpy.i0.",https://numpy.org/doc/stable/reference/generated/numpy.i0.html
480,https://numpy.org/doc/stable/reference/generated/numpy.true_divide.html,2025-09-25 09:36:18,success,,numpy.true_divide,NumPy,Python,,,numpy.divide,API Deprecation,"The `numpy.true_divide` function is effectively an alias for `numpy.divide`, making the distinction unnecessary and encouraging standardization.",https://numpy.org/doc/v2.3/reference/generated/numpy.true_divide.html
484,https://numpy.org/doc/stable/reference/generated/numpy.mod.html,2025-09-25 09:36:36,success,,mod,numpy,Python,,,remainder,Behavior Change,The behavior aligns with Python's modulus operator (`%`) but differs from MATLAB's `rem` function and C's `%` operator for floor division behavior. It aims for consistent mathematical behavior and functional equivalence.,https://numpy.org/doc/stable/reference/generated/numpy.mod.html
491,https://numpy.org/doc/stable/reference/generated/numpy.conj.html,2025-09-25 09:36:57,success,,numpy.conj,NumPy,Python,,,numpy.conjugate,API Deprecation,The alias `numpy.conj` is redundant and less explicit compared to `numpy.conjugate`.,https://numpy.org/doc/stable/reference/generated/numpy.conjugate.html
495,https://numpy.org/doc/stable/reference/generated/numpy.amax.html,2025-09-25 09:37:12,success,,amax,numpy,Python,,,numpy.max,Behavior Change,The `amax` function is considered an alias for `max` as it provides identical functionality. Aligning it further with `numpy.max` ensures consistency in naming conventions across the NumPy API.,https://numpy.org/doc/stable/reference/generated/numpy.amax.html
500,https://numpy.org/doc/stable/reference/generated/numpy.amin.html,2025-09-25 09:37:31,success,,numpy.amin,numpy,Python,,,numpy.min,API Deprecation,Alias of `numpy.min` to standardize function usage and reduce redundancy.,https://numpy.org/doc/stable/reference/generated/numpy.amin.html
505,https://numpy.org/doc/stable/reference/generated/numpy.sqrt.html,2025-09-25 09:37:52,success,,numpy.sqrt,numpy,Python,,,numpy.emath.sqrt (for complex numbers),Behavior Change,"To provide a consistent approach for calculating square roots of negative reals and complex numbers. The default numpy.sqrt returns NaN for negative reals and a complex array for complex inputs, while numpy.emath.sqrt handles negative reals by returning a complex result.",https://numpy.org/doc/2.3/reference/generated/numpy.sqrt.html
476,https://numpy.org/doc/stable/reference/generated/numpy.divide.html,2025-09-25 09:35:59,success,,numpy.divide,NumPy,Python,,,numpy.true_divide,API Deprecation,"numpy.true_divide is an alias for numpy.divide, offering clearer naming for true division operations. This change improves code clarity and documentation consistency.",https://numpy.org/doc/stable/reference/generated/numpy.divide.html
